Key;FR;EN
1;Il était une fois un homme qui avait de belles maisons à la ville et à la campagne, de la vaiselle d'or et d'argent, des meubles en broderies, et des carooses;There was once a man who had fine houses, both in town and country, a deal of silver and gold plate, embroidered furniture, and coaches gilded all over with gold.
2;Mais par malheur cet homme avait la Barbe bleue : cela le rendait si laid et si terrible, qu'il n'était ni femme ni fille qui ne s'enfuît de devant lui.;But this man was so unlucky as to have a blue beard, which made him so frightfully ugly that all the women and girls ran away from him.
3;Une de ses voisines, dame de qualité, avait deux filles;One of his neighbors, a lady of quality, had two daughters who were perfect beauties.
4;Il lui en demanda une en mariage. Elles n'en voulaient point toutes deux, ne pouvant se résoudre à prendre un homme qui eût la barbe bleue.;He desired of her one of them in marriage. Neither of them would have him, not being able to bear the thoughts of marrying a man who had a blue beard.
5;Ce qui les dégoûtait encore, c'est qu'il avait déjà épousé plusieurs femmes, et qu'on ne savait ce que ces femmes étaient devenues.;Adding to their disgust and aversion was the fact that he already had been married to several wives, and nobody knew what had become of them.